Product ID,Name,Price,Product Sub ID,Stock,Stock warning,Track inventory,Inventory rule,Items in stock on attr. level
"ad0080-1","Green miniaturize frog trinket box with Swarovski Elements Crystals","44.99000","","5","1","Yes","OutOfStock","",
"ad0080-2","Brown miniaturize frog trinket box with Swarovski Elements Crystals","44.99000","","2","1","Yes","OutOfStock","",
"ad0142-2","Mini white Christmas tree trinket box with Swarovski Elements Crystals","21.99000","","9","1","Yes","OutOfStock","",
"ad0166","Faberge style Russian silver egg trinket box with Swarovski Elements Crystals","119.99000","","62","1","Yes","OutOfStock","",
"ad0166-3","Faberge style Russian golden egg trinket box with Swarovski Elements Crystals","119.99000","","124","1","Yes","OutOfStock","",
"ad0179-1","Faberge style Russian pink egg trinket box with Swarovski Elements Crystals","82.99000","","1","1","Yes","OutOfStock","",
"ad0179-3","Faberge style Russian blue egg trinket box with Swarovski Elements Crystals","82.99000","","12","1","Yes","OutOfStock","",
"ad0179-4","Faberge style Russian purple egg trinket box with Swarovski Elements Crystals","82.99000","","10","1","Yes","OutOfStock","",
"ad300-11","Royal Blue Net Pattern Russian Faberge style Egg with Swarovski Element Crystals Trinket Pill Jewelry Box","99.99000","","5","1","Yes","OutOfStock","",
"ad300-6","Red Net Pattern Russian Faberge style Egg with Swarvski Element Crystals Trinket Pill Jewelry Box","99.99000","","5","1","Yes","OutOfStock","",
"b5bga008r0","Rose Gold Bangel with Cubic Zirconia Round Crystal Patterns","39.99000","","1","1","Yes","OutOfStock","",
"b5bga012p0","Cubic Zirconia Bangle Bracelet ZigZag Crystal Pattern","34.99000","","1","1","Yes","OutOfStock","",
"b5bga013p0","Cubic Zirconia Bangle Bracelet Crystal Square Patterns","24.99000","","1","1","Yes","OutOfStock","",
"b5bga015p0","Cubic Zirconia Bangle with Circular Single Crystal Pattern","34.99000","","1","1","Yes","OutOfStock","",
"b5bga016p0","Rhodium Cubic Zirconia Bangle Circualar Pattern Crystal","49.99000","","1","1","Yes","OutOfStock","",
"b5bga017p0","Cubic Zirconia Crystal Heart Patterns Bangle Bracelet","29.99000","","1","1","Yes","OutOfStock","",
"b5bga050p0","Cubic Zirconia Bangle Bracelet Circular Crystal Patterns","29.99000","","1","1","Yes","OutOfStock","",
"b5bra001p0","Cubic Zirconia Bracelet with Rhodium Finish and Crystals Pendant Patterns","29.99000","","1","1","Yes","OutOfStock","",
"b5bra002p0","Rhodium Plated Cubic Zirconia Bracelet with Round Crystal Pendants","33.99000","","1","1","Yes","OutOfStock","",
"b5bra003p0","Flower Design Cubic Zirconia Bracelet with Pendant Design","42.99000","","1","1","Yes","OutOfStock","",
"b5bra004p0","Rhodium Plated Bracelet with Swarovski Crystals With X Design","21.99000","","1","1","Yes","OutOfStock","",
"b5bra005p0","Oval Pattern Cubic Zirconia Rhodium Plated Bracelet","39.99000","","1","1","Yes","OutOfStock","",
"b5bra006p0","Rhodium Plated Cubic Zirconia Bracelet with Pendant Patterns","35.99000","","1","1","Yes","OutOfStock","",
"b5bra007p0","Round Cubic Zirconia Bracelet with Rhodium Finish","35.99000","","1","1","Yes","OutOfStock","",
"b5bra008p0","Link Chain Rhodium Plated Cubic Zirconia Bracelet","35.99000","","1","1","Yes","OutOfStock","",
"b5bra009p0","Cubic Zirconia Bracelet with Rhodium Finish Bow Design","29.99000","","1","1","Yes","OutOfStock","",
"b5bra010p0","Oval Hoop Cubic Zirconia Bracelet with Rhodium Finish","35.99000","","1","1","Yes","OutOfStock","",
"b5bra011p0","Link Chain Rhodium Plated Cubic Zirconia Bracelet","33.99000","","1","1","Yes","OutOfStock","",
"b5bra012p0","Bracelet with Cubic Zirconia Pendant Crystals and Heart Charms","33.99000","","1","1","Yes","OutOfStock","",
"b5bra013p0","Cubic Zirconia Bracelet with Rhodium Finish Round Pendant Crystals","27.99000","","1","1","Yes","OutOfStock","",
"b5bra014p0","Cubic Zirconia Bracelet with Rhodium Finish and X Charms","19.99000","","1","1","Yes","OutOfStock","",
"b5bra015p0","Star Charm Cubic Zirconia Bracelet with Rhodium Finish","14.99000","","1","1","Yes","OutOfStock","",
"b5bra016p0","Cubic Zirconia Bracelet with Circular Pendant and Crystals Patterns","23.99000","","1","1","Yes","OutOfStock","",
"b5bra017p0","Round Cubic Zirconia Crystal Pendant Patterns with Rhodium Finish","35.99000","","1","1","Yes","OutOfStock","",
"b5bra018p0","Oval Crystal Pattern Bracelet Cubic Zirconia with Rhodium Finish","20.99000","","1","1","Yes","OutOfStock","",
"b5bra019p0","Resizeale CZ Bracelet with Crystal Pendants","17.99000","","1","1","Yes","OutOfStock","",
"b5bra020p0","Cubic Zirconia Bracelet with Rhodium Finish Circular Crystal Pendants","27.99000","","1","1","Yes","OutOfStock","",
"b5bra021p0","Floral Design Cubic Zirconia Bracelet with Rhodium Finish","39.99000","","1","1","Yes","OutOfStock","",
"b5bra022p0","Cubic Zirconia Bracelet with Rhodium Finish and Round Crystal Pendants","23.99000","","1","1","Yes","OutOfStock","",
"b5bra023p0","Heart Pattern Cubic Zirconia Bracelet with Rhodium Finish","27.99000","","1","1","Yes","OutOfStock","",
"b5bra024p0","Cubic Zirconia Star Crystal Pattern Bracelet with Rhodium Plating","29.99000","","1","1","Yes","OutOfStock","",
"b5bra025p0","Resizeable Cubic Zirconia Heart Design Bracelet","24.99000","","1","1","Yes","OutOfStock","",
"b5bra026p0","Cubic Zirconia Bracelet with Crystal Pendant Pattern and Gold Plating","35.99000","","1","1","Yes","OutOfStock","",
"b5bra027p0","Cubic Zirconia Gold Plated Bracelet with Crystal Patterns","34.99000","","1","1","Yes","OutOfStock","",
"b5bra028p0","Cubic Zirconia Bracelet with Triangular Crystal Patterns","31.99000","","1","1","Yes","OutOfStock","",
"b5bra029p0","Round Crystal Pendant Pattern Bracelet with Rhodium Finish","18.99000","","1","1","Yes","OutOfStock","",
"b5bra030p0","Rhodium Finish Bracelet with Cubic Zirconia Crystal Pendants","17.99000","","1","1","Yes","OutOfStock","",
"b5bra031p0","Square Pendant Bracelet with Rhodium Finish","34.99000","","1","1","Yes","OutOfStock","",
"b5bra032p0","Cubic Zirconia Bracelet Circular Crystal Pendants Patterns with Rhodium Finish","18.99000","","1","1","Yes","OutOfStock","",
"b5bra033p0","Oval Shape Cubic Zirconia Bracelet with Rhodium Finish","35.99000","","1","1","Yes","OutOfStock","",
"b5bra040p0","CZ Bracelet with Star Shaped Crystal Pendants","29.99000","","1","1","Yes","OutOfStock","",
"b5bra041p0","Star Crystal Pendant Pattern Cubic Zirconia Bracelet with Rhodium Finish","27.99000","","1","1","Yes","OutOfStock","",
"b5bra042p0","Double Oval Cubic Zirconia Pendant Bracelet with Rhodium Finish","25.99000","","1","1","Yes","OutOfStock","",
"b5bra043p0","CZ Heart and Star Bracelet with Rhodium Finish","18.99000","","1","1","Yes","OutOfStock","",
"b5bra044p0","Star Design Cubic Zirconia Bracelet with Rhodium Finish","14.99000","","1","1","Yes","OutOfStock","",
"B5RSA001P0","Brand New Cubic Zirconia Rhodium Plated Snake Heads Ring","15.99000","","4","1","Yes","OutOfStock","",
"B5RSA002P0","Rhodium Plated Cubic Zirconia Long Multi Row Floral Ring","29.99000","","4","1","Yes","OutOfStock","",
"B5RSA003P0","Brand New Cubic Zirconia Long Net Pattern Ring","22.99000","","4","1","Yes","OutOfStock","",
"B5RSA004P0","Brand New Rhodium Plated Cubic Zirconia V Shaped Style Ring","15.99000","","4","1","Yes","OutOfStock","",
"B5RSA005P0","New Rhodium Plated Cubic Zirconia Spiral Shaped Star Ring","21.99000","","4","1","Yes","OutOfStock","",
"B5RSA006P0","New Rhodium Plated Cubic Zirconia Wavy Shaped Ring With Pearl","14.99000","","4","1","Yes","OutOfStock","",
"B5RSA007P0","Brand New Cubic Zirconia Circle Patterned Ring","15.99000","","4","1","Yes","OutOfStock","",
"B5RSA008P0","Brand New Cubic Zirconia Adjustable Open Back Sinuous Ring","15.99000","","4","1","Yes","OutOfStock","",
"B5RSA009P0","Solitaire Round Cut Cubic Zirconia Rhodium Plated Ring","12.99000","","4","1","Yes","OutOfStock","",
"B5RSA010P0","Brand New Cubic Zirconia Ring with Cross Style Stones","12.99000","","4","1","Yes","OutOfStock","",
"B5RSA011P0","Cubic Zirconia Bow Style Ring With Cubic Zirconia stones","10.99000","","4","1","Yes","OutOfStock","",
"B5RSA012P0","Brand New Cubic Zirconia Fish Style Ring With Cubic Zirconia stones","11.99000","","4","1","Yes","OutOfStock","",
"B5RSA013P0","New Round cut Cubic Zirconia Adjustable Open Back Ring","12.99000","","4","1","Yes","OutOfStock","",
"B5RSA014P0","Brand New Cubic Zirconia Rhodium Plated Band Ring","19.99000","","4","1","Yes","OutOfStock","",
"B5RSA015P0","Brand New Cubic Zirconia X Shaped Adjustable Open Back Ring","14.99000","","4","1","Yes","OutOfStock","",
"B5RSA016P0","Cubic Zirconia Rose Gold Bow Style Ring With Cubic Zirconia Side stones","10.99000","","4","1","Yes","OutOfStock","",
"B5RSA017P0","Brand New Cubic Zirconia Multi Row Wavy Shaped Adjustable Ring","18.99000","","4","1","Yes","OutOfStock","",
"B5RSA018P0","New Cubic Zirconia Small Midi Adjustable V Ring","9.99000","","4","1","Yes","OutOfStock","",
"B5RSA019P0","Rhodium Plated Cubic Zirconia Adjustable Serpent Ring","14.99000","","4","1","Yes","OutOfStock","",
"B5RSA020P0","Brand New Cubic Zirconia Rings with Multi Criss Cross Rows","28.99000","","4","1","Yes","OutOfStock","",
"B5RSA021P0","Brand New Cubic Zirconia X Shaped Ring","14.99000","","4","1","Yes","OutOfStock","",
"B5RSA022P0","Brand New Cubic Zirconia Circle Band Ring With Curved Front","12.99000","","4","1","Yes","OutOfStock","",
"B5RSA023P0","Brand New Cubic Zirconia Multi Row Spiral Shaped Circle Ring","15.99000","","4","1","Yes","OutOfStock","",
"B5RSA024P0","Cubic Zirconia Solitaire Round Cut Curved Style Ring","18.99000","","4","1","Yes","OutOfStock","",
"B5RSA025P0","Cubic Zirconia Serpent Style Ring with Red eyes Rhodium Plated","14.99000","","4","1","Yes","OutOfStock","",
"B5RSA026P0","Brand New Cubic Zirconia Adjustable Heart Shaped Ring","14.99000","","4","1","Yes","OutOfStock","",
"B5RSA027P0","Brand New Cubic Zirconia Adjustable Frame Circle Shaped Ring","13.99000","","4","1","Yes","OutOfStock","",
"B5RSA028P0","Brand New Cubic Zirconia Thick Multi Row Spiral Shaped Ring","22.99000","","4","1","Yes","OutOfStock","",
"B5RSA029P0","New Cubic Zirconia Multi Row Zig Zag Style Ring","22.99000","","4","1","Yes","OutOfStock","",
"B5RSA030P0","Brand New Curved Frame Ring With Swarovski Element Pearls","12.99000","","4","1","Yes","OutOfStock","",
"B5RSA031P0","Brand New Cubic Zirconia Multi Row Leaf Shaped Ring","19.99000","","4","1","Yes","OutOfStock","",
"B5RSA032P0","Brand New Rhodium Plated Thick Cubic Zirconia Ring with Multi Criss Cross Rows","88.99000","","4","1","Yes","OutOfStock","",
"B5RSA033P0","Cubic Zirconia Shield Style Ring with Multi Criss Cross Rows Rhodium Plated","33.99000","","4","1","Yes","OutOfStock","",
"B5RSA034P0","Brand New Cubic Zirconia Heart Shaped Multi Row Elongated Ring","45.99000","","4","1","Yes","OutOfStock","",
"b5rsa035p0","Brand New Cubic Zirconia 2 Finger Butterfly Ring with Pearl","34.99000","","4","1","Yes","OutOfStock","",
"B5RSA036P0","Rhodium Plated Cubic Zirconia Sphere Head Ring","27.99000","","4","1","Yes","OutOfStock","",
"B5RSA037P0","Brand New Set of 3 Cubic Zirconia Stackable Rings With Round Cut Stone","37.99000","","4","1","Yes","OutOfStock","",
"B5RSA038P0","Rhodium Plated Cubic Zirconia 2- Row Circled Pattern Ring","29.99000","","4","1","Yes","OutOfStock","",
"B5RSA039P0","Brand New Rhodium Plated Cubic Zirconia Diamond Circle Pattern Ring","22.99000","","4","1","Yes","OutOfStock","",
"B5RSA040P0","Brand New Rhodium Plated Cubic Zirconia Spiral Head Ring","27.99000","","4","1","Yes","OutOfStock","",
"B5RSA041P0","Rhodium Plated Cubic Zirconia 3- Row Circled Pattern Stackable Ring","49.99000","","4","1","Yes","OutOfStock","",
"B5RSA042P0","Rhodium Plated Cubic Zirconia Multi Zig Zag Style Rows Ring","27.99000","","4","1","Yes","OutOfStock","",
"B5RSA043P0","Rhodium Plated Cubic Zirconia Multi Curved Style Rows Ring With Swarovski Pearl","29.99000","","4","1","Yes","OutOfStock","",
"B5RSA044P0","Rhodium Plated Cubic Zirconia Solitaire Round Cut Ring With Clear cut Halo","44.99000","","4","1","Yes","OutOfStock","",
"B5RSA045P0","Rhodium Plated Cubic Zirconia Elongated Multi Criss Cross Rows Ring","22.99000","","4","1","Yes","OutOfStock","",
"B5RSA046P0","Brand New Cubic Zirconia Multi Row Crossover Rhodium Plated Ring","53.99000","","0","1","Yes","OutOfStock","",
"B5RSA047P0","Brand New Cubic Zirconia Diamond Shaped Multi Row Elongated Ring","19.99000","","4","1","Yes","OutOfStock","",
"B5RSA048P0","Brand New Cubic Zirconia Spiral Shaped Round Cut Star Ring With Side Stones","12.99000","","4","1","Yes","OutOfStock","",
"B5RSA049P0","Round Cut Cubic Zirconia Stones Rhodium Plated Ring With Side Stones","25.99000","","4","1","Yes","OutOfStock","",
"B5RSA050P0","Round Cut Cubic Zirconia 3 Stone Rhodium Plated Ring With Side Stones","44.99000","","4","1","Yes","OutOfStock","",
"B5RSA051P0","Brand New Cubic Zirconia Elongated Butterfly Stacked Ring","32.99000","","4","1","Yes","OutOfStock","",
"B5RSA052P0","Rhodium Plated Cubic Zirconia Elongated Ring With Middle Strip","11.99000","","4","1","Yes","OutOfStock","",
"B5RSA053P0","Brand New Cubic Zirconia Braided Shaped Multi Row Elongated Ring","42.99000","","4","1","Yes","OutOfStock","",
"B5RSA054P0","Rhodium Plated Cubic Zirconia 2- Row Square Pattern Ring","44.99000","","4","1","Yes","OutOfStock","",
"B5RSA055P0","Rhodium Plated Cubic Zirconia 2- Row Round Cut Stones Pattern Ring","39.99000","","4","1","Yes","OutOfStock","",
"B5RSA056P0","Rhodium Plated Cubic Zirconia Solitaire Round Cut Ring With Side Stones","24.99000","","4","1","Yes","OutOfStock","",
"B5RSA057P0","Rhodium Plated Cubic Zirconia Elongated Multi Crossover Style Rows Ring","22.99000","","4","1","Yes","OutOfStock","",
"B5RSA058P0","Rhodium Plated Cubic Zirconia Elongated Multi Crossover Armor Style Ring","38.99000","","4","1","Yes","OutOfStock","",
"b7nsa003p0","Double Chained Necklace Set with Pear shaped Pendant","84.99000","","1","0","Yes","Hide","",
"B7NSA004P0","Square Pendant Cubic Zirconia Necklace Set","121.99000","","1","0","Yes","Hide","",
"B7NSA005P0","Circular Cubic Zirconia Necklace Set","92.99000","","1","0","Yes","Hide","",
"B7NSA006P0","Double Pendant Chain Cubic Zirconia Necklace Set","100.99000","","1","0","Yes","Hide","",
"B7NSA007P0","Crystal Clear Cubic Zirconia Necklace Set","89.99000","","1","0","Yes","Hide","",
"B7NSA008P0","Cubic Zirconia Oval Shape Necklace Set with Clear Pendants","59.99000","","1","0","Yes","Hide","",
"B7NSA009P0","Pear Shape Pendant Cubic Zirconia Necklace Set","64.99000","","1","0","Yes","Hide","",
"B7NSA010P0","Crystal Clear Pattern Pendant Necklace Set","132.99000","","1","0","Yes","Hide","",
"B7NSA011P0","Oval Shape Pattern Pendant Cubic Zirconia Necklace Set","55.99000","","1","0","Yes","Hide","",
"B7NSA012P0","Pear Shape Necklace Set with Multiple Pendants and Earring","68.99000","","1","0","Yes","Hide","",
"b7nsa013p0","Cubic Zirconia Necklace and Earring Set with Inverted Flower Shaped Pendants","60.99000","","1","0","Yes","Hide","",
"B7NSA014P0","Round Pendant Cubic Zirconia Necklace and Earring set with oval and round shape crystals","96.99000","","1","0","Yes","Hide","",
"B7NSA015P0","Round Shape Cubic Zirconia Pendant Necklace and Earring Set","122.99000","","1","0","Yes","Hide","",
"B7NSA016P0","Pear and Round Shape Swarovski Crystal Necklace and Earring Set","84.99000","","1","0","Yes","Hide","",
"B7NSA017P0","Round Pattern Pendant Swarovski Crystal Necklace and Earring Set Ideal for Weddings and Formal Events","100.99000","","1","0","Yes","Hide","",
"B7NSA020P0","Pear and Round Shaped Cubic Zirconia Pendant Necklace","108.99000","","1","0","Yes","Hide","",
"B7NSA022P0","Small round shaped crystal Cubic Zirconia Necklace with Pear shaped pendants","89.99000","","1","0","Yes","Hide","",
"B7NSA025P0","Round and Pear Pattern Cubic Zirconia Necklace and Earring Set","86.99000","","1","0","Yes","Hide","",
"B7NSA026P0","Round Shape Cubic Zirconia Necklace and Earring Set Ideal for Weddings and Formal Events","62.99000","","1","0","Yes","Hide","",
"B7NSA027P0","Pear Necklace and Earring Set Cubic Zirconia crystals Necklace Ideal For Formal Events","100.99000","","1","0","Yes","Hide","",
"B7NSA029P0","Oval, Round and Pear Shaped Cubic Zirconia Necklace and Earring Set","51.99000","","1","0","Yes","Hide","",
"B7NSA030P0","Circular Pattern Cubic Zirconia Pendant Necklace Set","45.99000","","1","0","Yes","Hide","",
"B7NSA031P0","Cubic Zirconia Pendant Necklace Set","139.99000","","1","0","Yes","Hide","",
"B7NSA034P0","Round and Pear Pendant Pattern Swarovski Crystal Necklace and Earring Set","55.99000","","1","0","Yes","Hide","",
"B7NSA036P0","Green and Yellow with Purple Swarovski Crystal Necklace and Earring Set","45.99000","","1","0","Yes","Hide","",
"B7NSA037P0","Fashionable Round and Square Cubic Zirconia Necklace and Earring Set","61.99000","","1","0","Yes","Hide","",
"B7NSA038P0","Round Pendant Pattern with Pear Shaped Cubic Zirconia Necklace and Earring Set","71.99000","","1","0","Yes","Hide","",
"B7NSA040P0","Oval Pendant Pattern with Matching Earring Cubic Zirconia Necklace Set","63.99000","","1","0","Yes","Hide","",
"B7NSA041P0","Cubic Zirconia Necklace and Earring Set with Pear Shaped Pendant Pattern","44.99000","","1","0","Yes","Hide","",
"B7NSA042P0","Double Oval Pendant Pattern Cubic Zirconia Necklace and Earring Set","63.99000","","1","0","Yes","Hide","",
"B7NSA043P0","Flower Pattern Oval Shaped Pendant Cubic Zirconia Necklace and Earring Set","114.99000","","1","0","Yes","Hide","",
"B7NSA044P0","Star Shape Cubic Zirconia Necklace and Earring Set","64.99000","","1","0","Yes","Hide","",
"B7NSA047P0","Rectangular and Triangle Shaped Pendant with Round Pattern Necklace and Earring Set","125.99000","","1","0","Yes","Hide","",
"B7NSA049P0","Pear and Round Pendant Pattern Cubic Zirconia Necklace and Earring Set","121.99000","","1","0","Yes","Hide","",
"B7NSA050P0","Round Pendant Necklace with Star Pattern Cubic Zirconia Necklace and Earring Set","105.99000","","1","0","Yes","Hide","",
"B7NSA051P0","Round Cubic Zirconia Pendant Pattern Necklace and Earring Set","101.99000","","1","0","Yes","Hide","",
"b7nsa052p0","Sunflower Shaped Hanging Cubic Zirconia Pendant Necklace and Earring Set","59.99000","","1","0","Yes","Hide","",
"b7nsa053p0","Large Round Shaped Cubic Zirconia Pendant Necklace and Earring Set","104.99000","","1","0","Yes","Hide","",
"B7NSA057P0","Swarovski Crystal Round Pendant Necklace and Earring Set Ideal For Weddings and Formal Events","59.99000","","0","0","Yes","OutOfStock","",
"B7NSA058P0","Flower and Round Pendant Pattern Cubic Zirconia Necklace and Earring Set For Formal Events","62.99000","","1","0","Yes","Hide","",
"b7nsa065p0","Sun Shaped Pendant With Cubic Zirconia Necklace and Earring set","124.99000","","1","0","Yes","Hide","",
"B7NSA107P0","Pearl Necklace with Square Shape Crystals Necklace and Earring Set","44.99000","","1","0","Yes","Hide","",
"B7NSA108P0","Oval and Flower Shape Pendant Necklace and Earring Set Formal For Weddings and Formal Events","71.99000","","1","0","Yes","Hide","",
"b7nsa109p0","Circular Cubic Zirconia Hanging Pendants Necklace and Earrings","78.99000","","1","0","Yes","Hide","",
"B7NSA110P0","Round Pattern Pendant Necklace and Earring Set For Weddings","69.99000","","1","0","Yes","Hide","",
"B7NSA114P0","Cubic Zirconia Necklace and Earring Set with Round Shaped Pendants","192.99000","","1","0","Yes","Hide","",
"B7NSA115P0","Necklace and Earring Set with Round Shaped Pendant Patterns Ideal For Weddings and Formal Events","144.99000","","1","0","Yes","Hide","",
"B7NSA116P0","Oval Shaped Necklace and Earring Pendant Pattern Ideal For Formal Events","93.99000","","1","0","Yes","Hide","",
"B7NSA117P0","Small Round Shaped Crystal Pendant Necklace and Earring Set For Formal Events","140.99000","","1","0","Yes","Hide","",
"B7NSA140P0","Cubic Zirconia Necklace and Earring Set with Round Pendant Patterns Ideal for Weddings","399.99000","","1","0","Yes","OutOfStock","",
"B7NSA141P0","Round Shaped Crystal Necklace with Small Round Pendant Patterns Around Necklace and Earring Set Ideal For Weddings","44.99000","","1","0","Yes","Hide","",
"B7NSA142P0","Heart Shaped Necklace and Earrings Set For Formal Events and Weddings","58.99000","","1","0","Yes","Hide","",
"b7nsa152p0","Hanging Cubic Zirconia in a Line Necklace and Earrings to Match","59.99000","","1","0","Yes","Hide","",
"b7nsa155p0","Flower Shaped Central Pendant on Necklace and Hanging Pear Shaped Earrings","69.99000","","1","0","Yes","Hide","",
"b7nsa156p0","Oval Cubic Zirconia in a Flower Shape on Necklace and Earring Set","64.99000","","1","0","Yes","Hide","",
"b7pla001p0","Red Swarovski Crystal Brooches","25.99000","","1","1","Yes","OutOfStock","",
"b7pla002p0","Grey Swarovski Crystal Brooches","25.99000","","1","1","Yes","OutOfStock","",
"b7pla003p0","Purple Swarovski Crystal Brooches","25.99000","","1","1","Yes","OutOfStock","",
"b7pla004p0","Swarovski Crystal Brooches Green","25.99000","","1","1","Yes","OutOfStock","",
"b7pla005p0","Swarovski Crystal Brooches Blue","25.99000","","1","1","Yes","OutOfStock","",
"b7pla006g0","Swarovski Crystal Brooches Yellow","25.99000","","1","1","Yes","OutOfStock","",
"b7pla007p0","Red Swarovski Crystal Brooches with Double-Open Petal Flower Design","21.99000","","1","1","Yes","OutOfStock","",
"b7pla008p0","Black Swarovski Crystal Brooches with Double-Open Petal Flower Design","21.99000","","1","1","Yes","OutOfStock","",
"b7pla009p0","Swarovski Crystal Brooches with Double-Open Petal Flower Design White","21.99000","","1","1","Yes","OutOfStock","",
"b7pla010g0","Yellow Swarovski Crystal Brooches with Double-Open Petal Flower Design","21.99000","","1","1","Yes","OutOfStock","",
"b7pla011p0","Blue Swarovski Crystal Brooches with Double-Open Petal Flower Design","21.99000","","1","1","Yes","OutOfStock","",
"b7pla012p0","Brown Swarovski Crystal Brooches with Double-Open Petal Flower Design","21.99000","","1","1","Yes","OutOfStock","",
"b7pla013p0","Rose Oval Shape Swarovski Crystal Brooches with Multi Pendant Design","54.99000","","1","1","Yes","OutOfStock","",
"b7pla014p0","Blue Oval Shape Swarovski Crystal Brooches with Multi Pendant Design","54.99000","","1","1","Yes","OutOfStock","",
"b7pla015g0","Orange Oval Shape Swarovski Crystal Brooches with Multi Pendant Design","54.99000","","1","1","Yes","OutOfStock","",
"b7pla016p0","Purple Oval Shape Swarovski Crystal Brooches with Multi Pendant Design","54.99000","","1","1","Yes","OutOfStock","",
"b7pla017p0","Green Oval Shape Swarovski Crystal Brooches with Multi Pendant Design","54.99000","","1","1","Yes","OutOfStock","",
"b7pla018p0","Pink Triple Oval Brooch Design with Swarovski Element Crystals","53.99000","","1","1","Yes","OutOfStock","",
"b7pla019p0","White Triple Oval Brooch Design with Swarovski Element Crystals","53.99000","","1","1","Yes","OutOfStock","",
"b7pla020p0","Red Triple Oval Brooch Design with Swarovski Element Crystals","53.99000","","1","1","Yes","OutOfStock","",
"b7pla021g0","Pink Triple Oval Brooch Design with Swarovski Element Crystals","42.99000","","1","1","Yes","OutOfStock","",
"b7pla023p0","White Triple Oval Brooch Design with Swarovski Element Crystals","42.99000","","1","1","Yes","OutOfStock","",
"b7pla024p0","Green Triple Oval Brooch Design with Swarovski Element Crystals","42.99000","","1","1","Yes","OutOfStock","",
"b7pla025g0","Purple Triple Oval Brooch Design with Swarovski Element Crystals","42.99000","","1","1","Yes","OutOfStock","",
"b7pla026g0","Blue Triple Oval Brooch Design with Swarovski Element Crystals","42.99000","","1","1","Yes","OutOfStock","",
"b7pla027p0","White Flower Leaf Brooch with Swarovski Crystals","54.99000","","1","1","Yes","OutOfStock","",
"b7pla028g0","Orange Flower Leaf Brooch with Swarovski Crystals","54.99000","","1","1","Yes","OutOfStock","",
"b7pla029p0","Red Flower Leaf Brooch with Swarovski Crystals","54.99000","","1","1","Yes","OutOfStock","",
"b7pla030p0","Green Flower Leaf Brooch with Swarovski Crystals","54.99000","","1","1","Yes","OutOfStock","",
"b7pla031p0","White Flower Head Brooch with Swarovski Crystals","48.99000","","1","1","Yes","OutOfStock","",
"b7pla032p0","Pink Flower Head Brooch with Swarovski Crystals","48.99000","","1","1","Yes","OutOfStock","",
"b7pla033p0","Green Flower Head Brooch with Swarovski Crystals","48.99000","","1","1","Yes","OutOfStock","",
"b7pla034p0","Purple Flower Head Brooch with Swarovski Crystals","48.99000","","1","1","Yes","OutOfStock","",
"b7pla036g0","Orange Flower Head Brooch with Swarovski Crystals","48.99000","","1","1","Yes","OutOfStock","",
"b7pla037g0","Pink Swarovski Crystal Brooch with Multi Floral Leaf Design","45.99000","","0","1","Yes","OutOfStock","",
"b7pla038p0","White Swarovski Crystal Brooch with Multi Floral Leaf Design","45.99000","","1","1","Yes","OutOfStock","",
"b7pla039g0","Purple Swarovski Crystal Brooch with Multi Floral Leaf Design","45.99000","","1","1","Yes","OutOfStock","",
"b7pla040p0","Green Swarovski Crystal Brooch with Multi Floral Leaf Design","45.99000","","1","1","Yes","OutOfStock","",
"b7pla041g0","Yellow Swarovski Crystal Brooch with Multi Floral Leaf Design","45.99000","","1","1","Yes","OutOfStock","",
"b7pla042g0","Blue Swarovski Crystal Brooch with Multi Floral Leaf Design","45.99000","","0","1","Yes","OutOfStock","",
"b7pla043p0","Pink Swarovski Crystal Brooch Cat Queen Design","38.99000","","1","1","Yes","OutOfStock","",
"b7pla044g0","Yellow Swarovski Crystal Brooch Cat Queen Design","38.99000","","1","1","Yes","OutOfStock","",
"b7pla045b0","Red Swarovski Crystal Brooch Cat Queen Design","38.99000","","1","1","Yes","OutOfStock","",
"b7pla047g0","Green Swarovski Crystal Brooch Triple Rose Head with Leaves Design","30.99000","","1","1","Yes","OutOfStock","",
"b7pla048p0","Blue Swarovski Crystal Brooch Triple Rose Head with Leaves Design","30.99000","","1","1","Yes","OutOfStock","",
