"jd0595-1","Trinket Box with Swarovski Crystals Red Fish Jewelry Pill Box","43.99000","","6","1","Yes","OutOfStock","",
"jd0603","Kangaroo Trinket Box with Swarovski Crystals Jewelry Pill Box","41.99000","","4","1","Yes","OutOfStock","",
"jd0604a-3+jf1717-3","Royal Blue Russian Faberge Style Egg with mini Car Enamel Figurine with Swarovski Element Crystals Trinket Pill Jewelry Box","49.99000","","1","1","Yes","OutOfStock","",
"jd0604b-1+jf1709a-1","MIni Pink Net Pattern Faberge Style Egg With Floral Basket  Enamel Figurine with Swarovski Element Crystals Trinket Pill Jewelry Box","49.99000","","1","1","Yes","OutOfStock","",
"jd0605a","Lion Trinket Box with Swarovski Crystals Jewelry Pill Box","53.99000","","5","1","Yes","OutOfStock","",
"jd0606-2","Trinket Box with Swarovski Crystals Mini Pink Pigs Chilling Jewelry Pill Box","62.99000","","5","1","Yes","OutOfStock","",
"jd0609a+jf1709a","New Swarovski Crystal Feberge style small Red egg with Floral Basket Trinket Box","50.99000","","6","1","Yes","OutOfStock","",
"jd0609a-1+jf1717-1","Feberge style medium Rose Alabaster egg with mini wagon Trinket Box","40.99000","","5","1","Yes","OutOfStock","",
"jd0609a-4+jf1717-4","Feberge style medium Green  egg with mini wagon Trinket Box","40.99000","","1","1","Yes","OutOfStock","",
"jd0611-2","Trinket Box with Swarovski Element Crystals Orange Cat Jewelry Pill Box","39.99000","","1","1","Yes","OutOfStock","",
"jd0614-3","New Swarovski Crystal Bejeweled Fish with Coral Reef Collectible Trinket Box","49.99000","","5","1","Yes","OutOfStock","",
"jd0615-2","New Swarovski Crystal Bejeweled Gray Squirrels Trinket Box","42.99000","","1","1","Yes","OutOfStock","",
"jd0619","Swarovski Crystal Bejeweled Enamel Collectible Brown Cat Sitting Trinket Box","53.99000","","12","1","Yes","OutOfStock","",
"jd0619-2","Swarovski Crystal Bejeweled Enamel Collectible White Cat Sitting Trinket Box","53.99000","","11","1","Yes","OutOfStock","",
"jd0622-3","Swarovski Crystal Bejeweled Mini Brown Owl Trinket Box","31.99000","","4","1","Yes","OutOfStock","",
"jd0625-2","Swarovski Crystal Bejeweled Enamel Collectible Mini White Pig Trinket Box","22.99000","","1","1","Yes","OutOfStock","",
"jd0626-1","Mini Enamel Collectible Yellow Pig Swarovski Crystal Bejeweled Trinket Box","22.99000","","1","1","Yes","OutOfStock","",
"jd0627-2","White Pig Swarovski Crystal Bejeweled Trinket Box","22.99000","","0","1","Yes","OutOfStock","",
"jd0631","Light Brown Horse Swarovski Crystal Bejeweled Trinket Box","62.99000","","0","1","Yes","OutOfStock","",
"jd0633","Yellow Ladybug Swarovski Crystal Bejeweled Trinket Box","51.99000","","0","1","Yes","OutOfStock","",
"jd0633-3","Red Ladybug Swarovski Crystal Bejeweled  Trinket Box","51.99000","","3","1","Yes","OutOfStock","",
"jd0635-1","Dark Brown Deer(Buck) Swarovski Crystal bejeweled Trinket Box","46.99000","","10","1","Yes","OutOfStock","",
"jd0637-3","Trinket Box with Swarovski Crystals Red Flamingo Bird","51.99000","","2","1","Yes","OutOfStock","",
"jd0642-1","Dark Green Turtle out of Shell Trinket Box","37.99000","","2","1","Yes","OutOfStock","",
"jd0645a-2","White Poodle Dog Swarovski Crystal bejeweled Trinket Box","48.99000","","3","1","Yes","OutOfStock","",
"jd0646a-4+jd0205a-6","New Swarovski Crystal Bejeweled Green Russian Faberge Egg with Basket Trinket Box","119.99000","","7","1","Yes","OutOfStock","",
"jd0649","Monkey Holding a Banana Swarovski Crystal bejeweled Trinket Box","41.99000","","0","1","Yes","OutOfStock","",
"jd0653-1","Light Toucan Swarovski Crystal bejeweled Trinket Box","47.99000","","8","1","Yes","OutOfStock","",
"jd0653-2","Dark Toucan Swarovski Crystal bejeweled Trinket Box","47.99000","","9","1","Yes","OutOfStock","",
"jd0654-1","Mini Red Trumpet Swarovski Crystal bejeweled Trinket Box","46.99000","","12","1","Yes","OutOfStock","",
"jd0655-2","Red Saxophone Swarovski Crystal bejeweled Trinket Box","43.99000","","10","1","Yes","OutOfStock","",
"jd0656","Magenta Electric Guitar Swarovski Crystal bejeweled Trinket Box","41.99000","","10","1","Yes","OutOfStock","",
"jd0656-2","Blue Electric Guitar Swarovski Crystal bejeweled Trinket Box","41.99000","","1","1","Yes","OutOfStock","",
"jd0657-1","Rose Alabaster with Mirror Swarovski Crystal bejeweled Trinket Box","84.99000","","1","1","Yes","OutOfStock","",
"jd0657-3","Rose  with Mirror Swarovski Crystal bejeweled Trinket Box","84.99000","","10","1","Yes","OutOfStock","",
"jd0662-1","Brown Dachshund dog Swarovski Crystal bejeweled Trinket Box","31.99000","","0","1","Yes","OutOfStock","",
"jd0662-2","Swarovski Crystal bejeweled Trinket Box Black and White Dachshund dog","31.99000","","3","1","Yes","OutOfStock","",
"jd0663-1","Cream and Black Maltese Dog Swarovski Crystal bejeweled Trinket Box","35.99000","","5","1","Yes","OutOfStock","",
"jd0667","Life Sized Swarovski Crystal bejeweled Frog Trinket Box","36.99000","","11","1","Yes","OutOfStock","",
"jd0667-1","LIfe Sized Crystal Copper bejeweled Frog Trinket Box","36.99000","","14","1","Yes","OutOfStock","",
"jd0677-1","Swarovski Crystal bejeweled Toad Trinket Box","36.99000","","13","1","Yes","OutOfStock","",
"jd0684-1","Trinket Box with Swarovski Crystals Pink Poodle Laying Jewelry Pill Box","50.99000","","9","1","Yes","OutOfStock","",
"jd0684-2","Poodle Dog Swarovski Crystal bejeweled Trinket Box","50.99000","","10","1","Yes","OutOfStock","",
"jd0699","Green Floral Egg Trinket Box with Swarovski Crystals Jewelry Pill Box","57.99000","","5","1","Yes","OutOfStock","",
"jd0699-1","Red Floral Egg with Bird Nest Trinket Box with Swarovski Crystals Jewelry Pill Box","57.99000","","6","1","Yes","OutOfStock","",
"jd0699-2","Blue Floral Egg with Bird Nest Trinket Box with Swarovski Crystals","57.99000","","6","1","Yes","OutOfStock","",
"jd0724","Green Snowman Enamel Figurine with Swarovski Element Crystals Trinket Pill Jewelry Box","71.99000","","1","1","Yes","OutOfStock","",
"jd0724-1","Red Snowman Enamel Figurine with Swarovski Element Crystals Trinket Pill Jewelry Box","71.99000","","1","1","Yes","OutOfStock","",
"jd0729-1","Trinket Box with Swarovski Crystals Red and Green Birds Chilling Jewelry Box","61.99000","","1","1","Yes","OutOfStock","",
"jd0729-2","Trinket Box with Swarovski Crystals Orange and Green Birds Chilling Jewelry Box","61.99000","","1","1","Yes","OutOfStock","",
"jd0733","Green Lizard Trinket Box with Swarovski Element Crystals Jewelry Pill Box","54.99000","","15","1","Yes","OutOfStock","",
"jd0733-1","Orange Lizard Trinket Box with Swarovski Crystals Jewelry Pill Box","54.99000","","15","1","Yes","OutOfStock","",
"jd0733-2","Fuchsia Lizard Swarovski Crystal Bejeweled Trinket Box","54.99000","","16","1","Yes","OutOfStock","",
"jd0734","Pug Dog Swarovski Crystal Bejeweled Trinket Box","46.99000","","8","1","Yes","OutOfStock","",
"jd0734-1","Brown Pug Dog Swarovski Crystal Bejeweled Trinket Box","46.99000","","5","1","Yes","OutOfStock","",
"jd0737","Orange Goose Enamel Figurine with Swarovski Element Crystals Trinket Pill Jewelry Box","43.99000","","5","1","Yes","OutOfStock","",
"jd0737-2","Pink Goose Enamel Figurine with swarovski Element Crystals Trinket Pill Jewelry Box","43.99000","","4","1","Yes","OutOfStock","",
"jd0740-2","Bee Swarovski Crystal Bejeweled Trinket Box","34.99000","","11","1","Yes","OutOfStock","",
"jd0741-1","Elephant Trinket Box with Swarovski Element Crystals Jewelry Pill Box","39.99000","","7","1","Yes","OutOfStock","",
"jd0741-2","Elephant Swarovski Crystal  Bejeweled Trinket Box","39.99000","","8","1","Yes","OutOfStock","",
"jd0741-3","Small White Elephant Swarovski Crystal Bejeweled Trinket Box","39.99000","","5","1","Yes","OutOfStock","",
"jd0745","Green and Yellow Hot Air Balloon Trinket Box Jewelry Pill Box","82.99000","","9","1","Yes","OutOfStock","",
"jd0745-1","Red and Black Hot Air Balloon Swarovski Crystal Bejeweled Trinket Box","82.99000","","7","1","Yes","OutOfStock","",
"jd0745-2","Blue and Yellow Hot Air Balloon Trinket Jewelry Pill Box","82.99000","","9","1","Yes","OutOfStock","",
"jd0753","Red Royal Fortune Mouse Enamel Figurine with Swarovski Element Crystals Trinket Pill Jewelry Box","46.99000","","1","1","Yes","OutOfStock","",
"jd0754","Red and Black Royal Fortune Mouse Sitting Enamel Figurine with Swarovski Element Crystals Trinket Pill Jewelry Box","33.99000","","1","1","Yes","OutOfStock","",
"jd0757","Jonquil Buck Enamel Figurine with Swarovski Element Crystals Trinket Pill Jewelry Box","41.99000","","1","1","Yes","OutOfStock","",
"jd0761-2","Eagle Trinket Box with Swarovski Crystals Jewelry Pill Box","40.99000","","0","1","Yes","OutOfStock","",
"jd0763","Hot Brown Swarovski Crystal Bejeweled Turtle Trinket Box","36.99000","","0","1","Yes","OutOfStock","",
"jd0763-2","Turtle Swarovski Crystal Bejeweled Trinket Box","36.99000","","7","1","Yes","OutOfStock","",
"jd0766+jf1724b","Feberge style medium Red  egg with mini Crown Trinket Box","63.99000","","10","1","Yes","OutOfStock","",
"jd0766-1+jf1724b","Pink Faberge Style Egg Trinket Box with Swarovski Element Crystals Mini Crown","63.99000","","10","1","Yes","OutOfStock","",
"jd0766-3+jf1709a-3","Blue Faberge Style Egg Trinket Box with Swarovski Element Crystals Jewelry Box","57.99000","","1","1","Yes","OutOfStock","",
"jd0766-3+jf1724B","Feberge style medium Imperial Blue  egg with mini crown Trinket Box","57.99000","","10","1","Yes","OutOfStock","",
"jd0766-4+jf1709a-4","Green Faberge Style Egg Trinket Box with Swarovski Element Crystals Jewelry Box","57.99000","","7","1","Yes","OutOfStock","",
"jd0768-1+jd0205b-1","Pink Faberge Style Egg Trinket Box With Swarovski Element Crystals Net Pattern","76.99000","","1","1","Yes","OutOfStock","",
"jd0768-3+jd0205b-2","Blue Faberge Net Style Egg Trinket Box With Swarovski Element Crystals Net Pattern","76.99000","","7","1","Yes","OutOfStock","",
"jd0768-4+jd0205b-5","Feberge Russian style Green egg with Mini Floral Basket Swarovski Crystal Bejeweled Trinket Box","76.99000","","8","1","Yes","OutOfStock","",
"jd0770-1","Burgundy Camel with baby Trinket box with swarovski Crystals  Jewelry Pill Box","60.99000","","10","1","Yes","OutOfStock","",
"jd0770-2","Gray Camel with baby Trinket box with swarovski Crystals  Jewelry Pill Box","60.99000","","9","1","Yes","OutOfStock","",
"jd0772","Green Whale Trinket Box with Swarovski Element Crystals Jewelry Pill Box","41.99000","","8","1","Yes","OutOfStock","",
"jd0772-1","Miniature Orange Whale Trinket Box with Swarovski Crystals Pill Jewelry Box","41.99000","","9","1","Yes","OutOfStock","",
"jd0772-2","Black Whale Trinket Box with Swarovski Element Crystals Jewelry Pill Box","41.99000","","8","1","Yes","OutOfStock","",
"jd0774-1","White and Orange Goat Jewelry Box with Swarovski Element Crystals","39.99000","","7","1","Yes","OutOfStock","",
"jd0774-3","Orange Goat Jewelry Box with Swarovski Element Crystals Pill Trinket Box","39.99000","","6","1","Yes","OutOfStock","",
"jd0775-1","Smocked Topaz Buck Enamel Figurine with Swarovski Element Crystals Trinket Pill Jewelry Box","38.99000","","1","1","Yes","OutOfStock","",
"jd0775-2","Yellow Buck Enamel Figurine with Swarovski Element Crystals Trinket Pill Jewelry Box","38.99000","","1","1","Yes","OutOfStock","",
"jd0775-3","Moose Swarovski Crystal Bejeweled Trinket Box","38.99000","","7","1","Yes","OutOfStock","",
"jd0777+jf0205b-3","Red Faberge Net Style Egg Trinket Box With Swarovski Element Crystals Net Pattern","68.99000","","10","1","Yes","OutOfStock","",
"jd0777-4+jd0205b-5","Medium Feberge Style Green Egg with mini Floral Basket Swarovski Crystal Bejeweled Trinket Box","68.99000","","10","1","Yes","OutOfStock","",
"jd0777a+jf1724b","Feberge Style Red egg with mini Crown Swarovski Crystal Bejeweled Trinket Box","65.99000","","11","1","Yes","OutOfStock","",
"jd0777a-1+jf1724b","Swarovski Crystal Bejeweled Pink Russian Faberge style  Egg with Crown Trinket Box","65.99000","","11","1","Yes","OutOfStock","",
"jd0790","Tortoise Swarovski Crystal Bejeweled Trinket Box","38.99000","","9","1","Yes","OutOfStock","",
"jd0826","Gold Plated Floral Clutch with Swarovski Element Crystals","932.99000","","1","1","Yes","OutOfStock","",
"jd0826-10","Rhodium Plated Floral Clutch with Swarovski Element Crystals","932.99000","","1","1","Yes","OutOfStock","",
"jd0915","Swarovski Crystal Trinket Box Cockatoo Enamel Figurine","854.99000","","1","1","Yes","OutOfStock","",
"jd0924","Gold Plated Pink Floral Clutch with Swarovski Element Crystals","495.99000","","1","1","Yes","OutOfStock","",
"jd0963-1","Swarovski Crystal Trinket Box Toucan Enamel Figurine","854.99000","","1","1","Yes","OutOfStock","",
"jd0975","Immense Parrot Enamel Figurine with Swarovski Crystals","9999.99000","","1","1","Yes","OutOfStock","",
"jd1030","Gold Plated Purple floral Clutch with Swarovski Crystals","471.99000","","1","1","Yes","OutOfStock","",
"jd1030-1","Gold Plated Red Floral Clutch with Swarovski Element Crystals","471.99000","","1","2","Yes","OutOfStock","",
"jd1056-1","Enamel Peacock Swarovski Crystal Figurine","854.99000","","1","1","Yes","OutOfStock","",
"jd1065-2","Black Floral Clutch with Crystallized Swarovski Elements","757.99000","","2","1","Yes","OutOfStock","",
"jd1072-1","Immense Peacock Enamel Figurine with Swarovski Crystals","9999.99000","","1","1","Yes","OutOfStock","",
"jd1078a","Swarovski Crystal Trinket Box Camel Enamel Figurine","1559.99000","","1","1","Yes","OutOfStock","",
"jd1092","Butterfly Clutch with Pink and Purple Crystallized Swarovski Elements","932.99000","","2","1","Yes","OutOfStock","",
"jd1092-1","Butterfly Clutch with Yellow and Green Crystallized Swarovski Elements","932.99000","","4","1","Yes","OutOfStock","",
"jd1093-1","Yellow and Rose Pink Clutch with Crystallized Swarovski Elements","618.99000","","3","1","Yes","OutOfStock","",
"jd1095","Purple and Pink Floral Clutch with Swarovski Element Crystals","651.99000","","4","1","Yes","OutOfStock","",
"jd1095a-1","Floral Pattern Clutch with Swarovski Element Crystals","868.99000","","1","1","Yes","OutOfStock","",
"jd1097","Rose Alabaster Clutch with Floral Patterns","474.99000","","3","1","Yes","OutOfStock","",
"jd1161","Blue and Pink Butterfly Clutch with Crystallized Swarovski Elements","930.99000","","2","1","Yes","OutOfStock","",
"jd1161-1","Butterfly Clutch with Orange and Rose crystallized Swarovski Elements","930.99000","","2","1","Yes","OutOfStock","",
"jd1161-5","Blue Butterfly Clutch with Crystallized Swarovski Elements","930.99000","","2","1","Yes","OutOfStock","",
"jd1164","Gold Plated Tiger Clutch With Swarovski Element Crystals","792.99000","","3","1","Yes","OutOfStock","",
"jd1164-1","Rhodium Plated Tiger Clutch With Swarovski Crystal Necklace","792.99000","","4","1","Yes","OutOfStock","",
"jd1195-1","Swarovski Crystal Trinket Box Black Horse Enamel Figurine","793.99000","","1","1","Yes","OutOfStock","",
"jd1198-1","Floral Butterfly Clutch with Crystallized Swarovski Elements","884.99000","","1","1","Yes","OutOfStock","",
"jd1213-2","Rhodium Pearl Clutch with Swarovski Element Crystals","986.99000","","1","1","Yes","OutOfStock","",
"jd1213-5","Gold Plated Pearl Clutch with Swarovski Element Crystals","986.99000","","1","1","Yes","OutOfStock","",
"jd1216","Rose and Yellow Floral Clutch with Swarovski Element Crystals","961.99000","","4","1","Yes","OutOfStock","",
"jd1216-1","Blue Rose Pattern Clutch with Crystallized Swarovski Elements","961.99000","","2","1","Yes","OutOfStock","",
"jd1216-2","Rhodium Rose Pattern Clutch with Crystallized Swarovski Elements","961.99000","","1","1","Yes","OutOfStock","",
"jd1218-2","Black Nickel Floral Clutch with Crystallized Swarovski Element Crystals","834.99000","","1","1","Yes","OutOfStock","",
"jd1219","Blue and Pink Black Nickel Plated Clutch with Swarovski Element Crystals","932.99000","","1","1","Yes","OutOfStock","",
"jd1219-1","Flower Clutch with Crystallized Swarovski Elements","932.99000","","1","1","Yes","OutOfStock","",
"jd1254","Immense Cockatoo Enamel Figurine with Swarovski Crystals","9999.99000","","1","1","Yes","OutOfStock","",
"jd1259","Swarovski Crystal Trinket Box Poodle Enamel Figurine","1128.99000","","1","1","Yes","OutOfStock","",
"jd1279","Immense Giraffe Enamel Figurine with Swarovski Crystals","12999.99000","","1","1","Yes","OutOfStock","",
"jd642","Light Green Turtle out of Shell Swarovski Crystal Bejeweled Trinket Box","37.99000","","0","1","Yes","OutOfStock","",
"jdx001","Navy Miniature Christmas Tree Enamel Figurine with Swarovski Element Crystals Trinket Pill Jewelry Box","39.99000","","1","1","Yes","OutOfStock","",
"jdx002","Red Miniature Christmas Tree  Enamel Figurine with Swarovski Element Crystals Trinket Pill Jewelry Box","43.99000","","1","1","Yes","OutOfStock","",
"jdx003","White Miniature Christmas Tree  Enamel Figurine with Swarovski Element Crystals Trinket Pill Jewelry Box","43.99000","","1","1","Yes","OutOfStock","",
"jdx004","Green Miniature Christmas Tree  Enamel Figurine with Swarovski Element Crystals Trinket Pill Jewelry Box","43.99000","","1","1","Yes","OutOfStock","",
"jdx005","Red Miniature Christmas Tree with Gifts  Enamel Figurine with Swarovski Element Crystals Trinket Pill Jewelry Box","49.99000","","1","1","Yes","OutOfStock","",
"jdx006","Green Miniature Christmas Tree with Gifts  Enamel Figurine with Swarovski Element Crystals Trinket Pill Jewelry Box","49.99000","","1","1","Yes","OutOfStock","",
"jdx007","Red Snowman Tree Enamel Figurine with Swarovski Element Crystals Trinket Pill Jewelry Box","106.99000","","1","1","Yes","OutOfStock","",
"jdx008","Green Snowman Tree Enamel Figurine with Swarovski Element Crystals Trinket Pill Jewelry Box","106.99000","","1","1","Yes","OutOfStock","",
"jdx009","Santa Clause Tree Hat Enamel Figurine with Swarovski Element Crystals Trinket Pill Jewelry Box","59.99000","","1","1","Yes","OutOfStock","",
"jdx010","Red and Green Christmas Decorative Tree Enamel Figurine with Swarovski Element Crystals Trinket Pill Jewelry Box","73.99000","","1","1","Yes","OutOfStock","",
"jdx011","Santa Clause with Pink Gift Bag Enamel Figurine with Swarovski Element Crystals Trinket Pill Jewelry Box","99.99000","","0","1","Yes","OutOfStock","",
"jdx012","Santa Clause with Green Gift Bag Enamel Figurine with Swarovski Element Crystals Trinket Pill Jewelry Box","50.99000","","0","1","Yes","OutOfStock","",
"jdx013","Santa Clause with Red Gift Bag Enamel Figurine with Swarovski Element Crystals Trinket Pill Jewelry Box","50.99000","","1","1","Yes","OutOfStock","",
"jdx014","Santa Clause with Blue Gift Bag Enamel Figurine with Swarovski Element Crystals Trinket Pill Jewelry Box","50.99000","","1","1","Yes","OutOfStock","",
"jdx015","Miniature Snowman with Lime Sweater Enamel Figurine with Swarovski Element Crystals Trinket Pill Jewelry Box","36.99000","","0","1","Yes","OutOfStock","",
"jdx016","Snowman with Dark Green Sweater Enamel Figurine with Swarovski Element Crystals Trinket Pill Jewelry Box","60.99000","","1","1","Yes","OutOfStock","",
"jdx017","Lime Snowman with Blue Vest Enamel Figurine with Swarovski Element Crystals Trinket Pill Jewelry Box","50.99000","","1","1","Yes","OutOfStock","",
"jdx018","Miniature Light Green Snowman Enamel Figurine with Swarovski Element Crystals Trinket Pill Jewelry Box","60.99000","","1","1","Yes","OutOfStock","",
"jdx019","Purple Floral Pillar Enamel Figurine with Swarovski Element Crystals Trinket Pill Jewelry Box","47.99000","","1","1","Yes","OutOfStock","",
"jdx020","Santa Clause on a Blue Sleigh Enamel Figurine with Swarovski Element Crystals Trinket Pill Jewelry Box","47.99000","","1","1","Yes","OutOfStock","",
"jdx021","Santa Clause on a Green Sleigh Enamel Figurine with Swarovski Element Crystals Trinket Pill Jewelry Box","74.99000","","1","1","Yes","OutOfStock","",
"jdx022","Santa Clause with a Blue Sleigh Enamel Figurine with Swarovski Element Crystals Trinket Pill Jewelry Box","86.99000","","1","1","Yes","OutOfStock","",
"jdx023","Green Christmas Stocking Enamel Figurine with Swarovski Element Crystals Trinket Pill Jewelry Box","99.99000","","1","1","Yes","OutOfStock","",
"jdx024","Cute Pink Rabbit Enamel Figurine with Swarovski Element Crystals Trinket Pill Jewelry Box","35.99000","","0","1","Yes","OutOfStock","",
"jdx025","Cute Pink Rabbit with Carrot  Enamel Figurine with Swarovski Element Crystals Trinket Pill Jewelry Box","39.99000","","1","1","Yes","OutOfStock","",
"jdx026","Cute Hot Pink Rabbit  Enamel Figurine with Swarovski Element Crystals Trinket Pill Jewelry Box","39.99000","","0","1","Yes","OutOfStock","",
"jdx027","Miniature Rabbit in a Boot  Enamel Figurine with Swarovski Element Crystals Trinket Pill Jewelry Box","87.99000","","1","1","Yes","OutOfStock","",
"jdx028","Miniature Brown Rabbit  Enamel Figurine with Swarovski Element Crystals Trinket Pill Jewelry Box","39.99000","","1","1","Yes","OutOfStock","",
"jdx029","White Rabbit with Carrot  Enamel Figurine with Swarovski Element Crystals Trinket Pill Jewelry Box","39.99000","","0","1","Yes","OutOfStock","",
"jdx030","Miniature Red Christmas Theme  Box Enamel Figurine with Swarovski Element Crystals Trinket Pill Jewelry Box","29.99000","","1","1","Yes","OutOfStock","",
"jdx031","Miniature Green Christmas Theme Box Enamel Figurine with Swarovski Element Crystals Trinket Pill Jewelry Box","29.99000","","1","1","Yes","OutOfStock","",
"jdx032","Christamas Decorative Bell Enamel Figurine with Swarovski Element Crystals Trinket Pill Jewelry Box","76.99000","","1","1","Yes","OutOfStock","",
"jdx0329","Red Christmas Stocking Enamel Figurine with Swarovski Element Crystals Trinket Pill Jewelry Box","99.99000","","1","1","Yes","OutOfStock","",
"jdx033","Circular Santa Clause Enamel Figurine with Swarovski Element Crystals Trinket Pill Jewelry Box","66.99000","","1","1","Yes","OutOfStock","",
"jdx034","Green Miniature Christmas House Enamel Figurine with Swarovski Element Crystals Trinket Pill Jewelry Box","110.99000","","0","1","Yes","OutOfStock","",
"jdx035","Orange Miniature Christmas House Enamel Figurine with Swarovski Element Crystals Trinket Pill Jewelry Box","110.99000","","1","1","Yes","OutOfStock","",
"jdx036","Miniature Christmas Decorative Building Enamel Figurine with Swarovski Element Crystals Trinket Pill Jewelry Box","43.99000","","0","1","Yes","OutOfStock","",
"jdx037","Christmas Bear Enamel Figurine with Swarovski Element Crystals Trinket Pill Jewelry Box","60.99000","","1","1","Yes","OutOfStock","",
"jdx038","Blue Decorative Box Enamel Figurine with Swarovski Element Crystals Trinket Pill Jewelry Box","26.99000","","1","1","Yes","OutOfStock","",
"jdx039","Miniature Santa Clause with Small Blue Gift Bag Enamel Figurine with Swarovski Element Crystals Trinket Pill Jewelry Box","53.99000","","1","1","Yes","OutOfStock","",
"jdx040","Green Santa Clause Snow Skiing Enamel Figurine with Swarovski Element Crystals Trinket Pill Jewelry Box","40.99000","","1","1","Yes","OutOfStock","",
"jdx043","White and Black Antique Train  Enamel Figurine with Swarovski Element Crystals Trinket Pill Jewelry Box","72.99000","","1","1","Yes","OutOfStock","",
"jdx044","Wild Turkey  Enamel Figurine with Swarovski Element Crystals Trinket Pill Jewelry Box","51.99000","","1","1","Yes","OutOfStock","",
"jdx045","Angel Music Box  Enamel Figurine with Swarovski Element Crystals Trinket Pill Jewelry Box","99.99000","","1","1","Yes","OutOfStock","",
"jdx046","Miniature Cherry Enamel Figurine with Swarovski Element Crystals Trinket Pill Jewelry Box","37.99000","","0","1","Yes","OutOfStock","",
"jdx047","Miniature Floral Chair Enamel Figurine with Swarovski Element Crystals Trinket Pill Jewelry Box","35.99000","","1","1","Yes","OutOfStock","",
"jm0001-2t","Brand New Hand Painted Enameled Swarovski Element Crystals Grey Compact Mirror With Lizard And Ladybug On Leaf Design","21.99000","","0","0","Yes","Hide","",
"jm0001-4t","Brand New Hand Painted Enameled Swarovski Element Crystals Gold Compact Mirror With Lizard And Ladybug On Leaf Design","21.99000","","0","0","Yes","Hide","",
"jm0005-3t","Brand New Hand Painted Enameled Swarovski Element Crystals Purple Compact Mirror With Bee And Dragonfly Design","23.99000","","0","0","Yes","Hide","",
"jm0005-4t","Brand New Hand Painted Enameled Swarovski Element Crystals Blue Compact Mirror With Bee And Dragonfly Design","23.99000","","0","0","Yes","Hide","",
"jm0005t","Brand New Hand Painted Enameled Swarovski Element Crystals Yellow Compact Mirror With Bee And Dragonfly Design","23.99000","","0","0","Yes","Hide","",
"jm0006-1t","Brand New Hand Painted Enameled Swarovski Element Crystals Yellow Compact Mirror With Bee And Butterfly Design","23.99000","","0","0","Yes","Hide","",
"jm0006-2t","Brand New Hand Painted Enameled Swarovski Element Crystals Light Grey Compact Mirror With Bee And Butterfly Design","23.99000","","0","0","Yes","Hide","",
"jm0006-4t","Brand New Hand Painted Enameled Swarovski Element Crystals Purple Compact Mirror With Bee And Butterfly Design","23.99000","","0","0","Yes","Hide","",
"jm0006-7t","Brand New Hand Painted Enameled Swarovski Element Crystals Light Green Compact Mirror With Bee And Butterfly Design","23.99000","","0","0","Yes","Hide","",
"jm0006-9t","Brand New Hand Painted Enameled Swarovski Element Crystals Pink Compact Mirror With Bee And Butterfly Design","23.99000","","0","0","Yes","Hide","",
"jm0043-1","Brand New Hand Painted Enameled Swarovski Element Crystals Compact Mirror With Brown Fish Design","23.99000","","0","0","Yes","Hide","",
"jm0047-1t","Brand New Hand Painted Enameled Swarovski Element Crystals Compact Mirror Red Topaz Snake On Floral Design","28.99000","","0","0","Yes","Hide","",
"jm0047-4t","Brand New Hand Painted Enameled Swarovski Element Crystals Compact Mirror Purple Snake On Floral Design","28.99000","","0","0","Yes","Hide","",
"jm0047-5t","Brand New Hand Painted Enameled Swarovski Element Crystals Compact Mirror Green Snake On Floral Design","28.99000","","0","0","Yes","Hide","",
